{"abstract_carrier_profile":{"candidate_record_count":69,"carrier_size":1894736,"locator_degree":981105,"minimum_pair_exchange":67472,"shortened_grs_minimum_distance":1048577,"unit":"ABSTRACT_F_P_VALUED_CARRIER_RECORDS_NOT_DEPLOYED_SLOPES","zero_count":913631},"architecture_id":null,"artifact_kind":"EXACT_ABSTRACT_COUNTERMODEL_TO_PAIRWISE_AND_TERNARY_SECANT_CIRCUIT_CAP68_INFERENCE","audit":{"conjecture":"FULL_PRIMITIVE_69_POINT_EXCLUSION_REMAINS_OPEN","empirical_evidence":"WITNESS_OPTIMIZATION_AND_FULL_SPAN_SEARCH_ARE_NOT_USED_AS_PROOF","global_verdict":"YELLOW_ROW_OPEN","layer_cake_dyadic_summability":"NOT_APPLICABLE","moment_markov_chebyshev":"NOT_APPLICABLE","proof":"EXACT_FINITE_COUNTERMODEL_TO_A_WEAKENED_INFERENCE"},"closure_state":{"B_remaining_after":null,"B_remaining_before":null,"U_paid_after":null,"U_paid_before":null,"additional_charge":0,"cap_68_proved":false,"equality_wall_paid":false,"row_budget_B_star":274980728111395087,"row_closed":false,"terminal":"ROUTE_CUT_PAIRWISE_TERNARY_CIRCUIT_INFERENCE_REQUIRES_FULL_SPAN_GRS_POLYNOMIAL_OR_OWNER_INPUT"},"construction":{"ambient_affine_dimension":8,"coordinate_value":"DOT_VERTEX_NORMAL_MINUS_AFFINE_OFFSET_MOD_P","declared_empty_affine_level":99,"scalar_extension":"F_P_VALUES_VIEWED_IN_F_P6_PRESERVE_HAMMING_WEIGHT_AND_BASE_FIELD_RANK","sealed_witness_sha256":"5fbaed397c3cf788d6805c7b203e4a94e95ea8a13bdd74e54c393220ddcdd788","vertex_encoding":"EIGHT_SIGN_COORDINATES_FROM_BINARY_INDEX","vertex_indices":[0,1,2,3,4,5,6,7,8,9,10,11,12,13,14,15,16,17,18,19,20,21,22,23,24,25,26,27,28,29,30,31,32,33,34,35,36,37,38,39,40,41,42,43,44,45,46,47,48,49,50,51,52,53,54,55,56,57,58,59,60,61,62,63,64,65,66,67,128]},"exact_results":{"affine_rank":8,"canonical_circuit_restriction_rank_histogram":{"2":13,"3":15,"4":7,"5":10,"6":15},"canonical_circuit_size_histogram":{"4":17,"5":21,"6":15,"7":6,"8":1},"canonical_nonbasis_circuit_count":60,"canonical_star_basis_indices":[1,2,4,8,16,32,64,128],"circuit_digest":"07fb66bb40f6ce02a2dd39aa6723dce3457b41c782a1f808a3399f697526ac58","circuits":[{"basis_vertices":[1,2],"coefficient_vector":[{"coefficient":1,"vertex":0},{"coefficient":-1,"vertex":1},{"coefficient":-1,"vertex":2},{"coefficient":1,"vertex":3}],"common_zero_coordinates":403064,"common_zero_type_count":7,"no_singleton_atoms":true,"required_rank_upper":6,"restriction_rank":5,"size":4,"target_index":3,"vertices":[0,1,2,3]},{"basis_vertices":[1,4],"coefficient_vector":[{"coefficient":1,"vertex":0},{"coefficient":-1,"vertex":1},{"coefficient":-1,"vertex":4},{"coefficient":1,"vertex":5}],"common_zero_coordinates":392796,"common_zero_type_count":12,"no_singleton_atoms":true,"required_rank_upper":6,"restriction_rank":6,"size":4,"target_index":5,"vertices":[0,1,4,5]},{"basis_vertices":[2,4],"coefficient_vector":[{"coefficient":1,"vertex":0},{"coefficient":-1,"vertex":2},{"coefficient":-1,"vertex":4},{"coefficient":1,"vertex":6}],"common_zero_coordinates":414198,"common_zero_type_count":12,"no_singleton_atoms":true,"required_rank_upper":6,"restriction_rank":6,"size":4,"target_index":6,"vertices":[0,2,4,6]},{"basis_vertices":[1,2,4],"coefficient_vector":[{"coefficient":2,"vertex":0},{"coefficient":-1,"vertex":1},{"coefficient":-1,"vertex":2},{"coefficient":-1,"vertex":4},{"coefficient":1,"vertex":7}],"common_zero_coordinates":358913,"common_zero_type_count":4,"no_singleton_atoms":true,"required_rank_upper":5,"restriction_rank":3,"size":5,"target_index":7,"vertices":[0,1,2,4,7]},{"basis_vertices":[1,8],"coefficient_vector":[{"coefficient":1,"vertex":0},{"coefficient":-1,"vertex":1},{"coefficient":-1,"vertex":8},{"coefficient":1,"vertex":9}],"common_zero_coordinates":421922,"common_zero_type_count":11,"no_singleton_atoms":true,"required_rank_upper":6,"restriction_rank":6,"size":4,"target_index":9,"vertices":[0,1,8,9]},{"basis_vertices":[2,8],"coefficient_vector":[{"coefficient":1,"vertex":0},{"coefficient":-1,"vertex":2},{"coefficient":-1,"vertex":8},{"coefficient":1,"vertex":10}],"common_zero_coordinates":425392,"common_zero_type_count":11,"no_singleton_atoms":true,"required_rank_upper":6,"restriction_rank":6,"size":4,"target_index":10,"vertices":[0,2,8,10]},{"basis_vertices":[1,2,8],"coefficient_vector":[{"coefficient":2,"vertex":0},{"coefficient":-1,"vertex":1},{"coefficient":-1,"vertex":2},{"coefficient":-1,"vertex":8},{"coefficient":1,"vertex":11}],"common_zero_coordinates":360399,"common_zero_type_count":4,"no_singleton_atoms":true,"required_rank_upper":5,"restriction_rank":3,"size":5,"target_index":11,"vertices":[0,1,2,8,11]},{"basis_vertices":[4,8],"coefficient_vector":[{"coefficient":1,"vertex":0},{"coefficient":-1,"vertex":4},{"coefficient":-1,"vertex":8},{"coefficient":1,"vertex":12}],"common_zero_coordinates":405448,"common_zero_type_count":9,"no_singleton_atoms":true,"required_rank_upper":6,"restriction_rank":6,"size":4,"target_index":12,"vertices":[0,4,8,12]},{"basis_vertices":[1,4,8],"coefficient_vector":[{"coefficient":2,"vertex":0},{"coefficient":-1,"vertex":1},{"coefficient":-1,"vertex":4},{"coefficient":-1,"vertex":8},{"coefficient":1,"vertex":13}],"common_zero_coordinates":361416,"common_zero_type_count":5,"no_singleton_atoms":true,"required_rank_upper":5,"restriction_rank":3,"size":5,"target_index":13,"vertices":[0,1,4,8,13]},{"basis_vertices":[2,4,8],"coefficient_vector":[{"coefficient":2,"vertex":0},{"coefficient":-1,"vertex":2},{"coefficient":-1,"vertex":4},{"coefficient":-1,"vertex":8},{"coefficient":1,"vertex":14}],"common_zero_coordinates":367191,"common_zero_type_count":6,"no_singleton_atoms":true,"required_rank_upper":5,"restriction_rank":5,"size":5,"target_index":14,"vertices":[0,2,4,8,14]},{"basis_vertices":[1,2,4,8],"coefficient_vector":[{"coefficient":3,"vertex":0},{"coefficient":-1,"vertex":1},{"coefficient":-1,"vertex":2},{"coefficient":-1,"vertex":4},{"coefficient":-1,"vertex":8},{"coefficient":1,"vertex":15}],"common_zero_coordinates":353486,"common_zero_type_count":3,"no_singleton_atoms":true,"required_rank_upper":4,"restriction_rank":2,"size":6,"target_index":15,"vertices":[0,1,2,4,8,15]},{"basis_vertices":[1,16],"coefficient_vector":[{"coefficient":1,"vertex":0},{"coefficient":-1,"vertex":1},{"coefficient":-1,"vertex":16},{"coefficient":1,"vertex":17}],"common_zero_coordinates":394761,"common_zero_type_count":9,"no_singleton_atoms":true,"required_rank_upper":6,"restriction_rank":6,"size":4,"target_index":17,"vertices":[0,1,16,17]},{"basis_vertices":[2,16],"coefficient_vector":[{"coefficient":1,"vertex":0},{"coefficient":-1,"vertex":2},{"coefficient":-1,"vertex":16},{"coefficient":1,"vertex":18}],"common_zero_coordinates":408949,"common_zero_type_count":9,"no_singleton_atoms":true,"required_rank_upper":6,"restriction_rank":5,"size":4,"target_index":18,"vertices":[0,2,16,18]},{"basis_vertices":[1,2,16],"coefficient_vector":[{"coefficient":2,"vertex":0},{"coefficient":-1,"vertex":1},{"coefficient":-1,"vertex":2},{"coefficient":-1,"vertex":16},{"coefficient":1,"vertex":19}],"common_zero_coordinates":360399,"common_zero_type_count":4,"no_singleton_atoms":true,"required_rank_upper":5,"restriction_rank":3,"size":5,"target_index":19,"vertices":[0,1,2,16,19]},{"basis_vertices":[4,16],"coefficient_vector":[{"coefficient":1,"vertex":0},{"coefficient":-1,"vertex":4},{"coefficient":-1,"vertex":16},{"coefficient":1,"vertex":20}],"common_zero_coordinates":388180,"common_zero_type_count":10,"no_singleton_atoms":true,"required_rank_upper":6,"restriction_rank":6,"size":4,"target_index":20,"vertices":[0,4,16,20]},{"basis_vertices":[1,4,16],"coefficient_vector":[{"coefficient":2,"vertex":0},{"coefficient":-1,"vertex":1},{"coefficient":-1,"vertex":4},{"coefficient":-1,"vertex":16},{"coefficient":1,"vertex":21}],"common_zero_coordinates":371025,"common_zero_type_count":6,"no_singleton_atoms":true,"required_rank_upper":5,"restriction_rank":5,"size":5,"target_index":21,"vertices":[0,1,4,16,21]},{"basis_vertices":[2,4,16],"coefficient_vector":[{"coefficient":2,"vertex":0},{"coefficient":-1,"vertex":2},{"coefficient":-1,"vertex":4},{"coefficient":-1,"vertex":16},{"coefficient":1,"vertex":22}],"common_zero_coordinates":362451,"common_zero_type_count":5,"no_singleton_atoms":true,"required_rank_upper":5,"restriction_rank":4,"size":5,"target_index":22,"vertices":[0,2,4,16,22]},{"basis_vertices":[1,2,4,16],"coefficient_vector":[{"coefficient":3,"vertex":0},{"coefficient":-1,"vertex":1},{"coefficient":-1,"vertex":2},{"coefficient":-1,"vertex":4},{"coefficient":-1,"vertex":16},{"coefficient":1,"vertex":23}],"common_zero_coordinates":353486,"common_zero_type_count":3,"no_singleton_atoms":true,"required_rank_upper":4,"restriction_rank":2,"size":6,"target_index":23,"vertices":[0,1,2,4,16,23]},{"basis_vertices":[8,16],"coefficient_vector":[{"coefficient":1,"vertex":0},{"coefficient":-1,"vertex":8},{"coefficient":-1,"vertex":16},{"coefficient":1,"vertex":24}],"common_zero_coordinates":392382,"common_zero_type_count":9,"no_singleton_atoms":true,"required_rank_upper":6,"restriction_rank":6,"size":4,"target_index":24,"vertices":[0,8,16,24]},{"basis_vertices":[1,8,16],"coefficient_vector":[{"coefficient":2,"vertex":0},{"coefficient":-1,"vertex":1},{"coefficient":-1,"vertex":8},{"coefficient":-1,"vertex":16},{"coefficient":1,"vertex":25}],"common_zero_coordinates":377222,"common_zero_type_count":6,"no_singleton_atoms":true,"required_rank_upper":5,"restriction_rank":5,"size":5,"target_index":25,"vertices":[0,1,8,16,25]},{"basis_vertices":[2,8,16],"coefficient_vector":[{"coefficient":2,"vertex":0},{"coefficient":-1,"vertex":2},{"coefficient":-1,"vertex":8},{"coefficient":-1,"vertex":16},{"coefficient":1,"vertex":26}],"common_zero_coordinates":368223,"common_zero_type_count":6,"no_singleton_atoms":true,"required_rank_upper":5,"restriction_rank":4,"size":5,"target_index":26,"vertices":[0,2,8,16,26]},{"basis_vertices":[1,2,8,16],"coefficient_vector":[{"coefficient":3,"vertex":0},{"coefficient":-1,"vertex":1},{"coefficient":-1,"vertex":2},{"coefficient":-1,"vertex":8},{"coefficient":-1,"vertex"